{
  "capability_decisions": {
    "path": "docs/agent-program/kiana-completion/governance/capability-decisions/review-2026-07-22.json",
    "revision_id": "governance-review-2026-07-22-v1.capability-decisions",
    "sha256": "d1b794ff8a501e76e7164c83bae572c08db38c829f342344a45ec884adf71f2e"
  },
  "evaluation_time": "2026-07-22T16:14:52Z",
  "evidence_head": {
    "path": "docs/agent-program/kiana-completion/governance/evidence/revisions/evidence-2026-07-22.json",
    "revision_id": "governance-review-2026-07-22-v1.evidence",
    "sha256": "b4a8112cd2e7d544ab260e856ca075dae41b62904837dbeffe987f6990f3a046"
  },
  "legacy_authority": {
    "path": "docs/agent-program/kiana-completion/governance/legacy-authority/legacy-authority-2026-07-15.json",
    "revision_id": "legacy-authority-2026-07-15-reviewed",
    "sha256": "6f7b8408979f3a68c64c32d3c5b1dd0175da88a5d5ee95da06895864db90eb60"
  },
  "official_source_artifact": {
    "artifact_id": "cc-public-official-2026-07-15",
    "path": "docs/agent-program/kiana-completion/governance/source-artifacts/claude-code-public-2026-07-15.json",
    "sha256": "ef875bdcf1d808083680d7a7c0be320d3bdc3938ec95c78594cb7471af69f850"
  },
  "public_baseline": {
    "path": "docs/agent-program/kiana-completion/governance/public-baselines/cc-public-2026-07-15.json",
    "revision_id": "cc-public-baseline-2026-07-15-reviewed",
    "sha256": "f680007984bf8865469a315361e3e792a21de85731e1ccdac6a07313061af02e"
  },
  "repository_registry": {
    "path": "docs/agent-program/kiana-completion/governance/repository-registry/references-2026-07-22.json",
    "revision_id": "governance-review-2026-07-18-v1.repository-registry",
    "sha256": "3dfbd79d4ebe353408a3be8c01d403ca059dfc9d9dfdb3375013e55023ce9f76"
  },
  "schema": "kiana.capability-governance-bundle.v1",
  "version": "1.0"
}
